PMID,Title,Authors,Citation,First Author,Journal/Book,Publication Year,Create Date,PMCID,NIHMS ID,DOI
"33846625","Brain proteome-wide association study implicates novel proteins in depression pathogenesis","Wingo TS, Liu Y, Gerasimov ES, Gockley J, Logsdon BA, Duong DM, Dammer EB, Lori A, Kim PJ, Ressler KJ, Beach TG, Reiman EM, Epstein MP, De Jager PL, Lah JJ, Bennett DA, Seyfried NT, Levey AI, Wingo AP.","Nat Neurosci. 2021 Jun;24(6):810-817. doi: 10.1038/s41593-021-00832-6. Epub 2021 Apr 12.","Wingo TS","Nat Neurosci","2021","2021/04/13","PMC8530461","NIHMS1680458","10.1038/s41593-021-00832-6"
"33288654","Computational Tools for Causal Inference in Genetics","Richardson TG, Zheng J, Gaunt TR.","Cold Spring Harb Perspect Med. 2021 Jun 1;11(6):a039248. doi: 10.1101/cshperspect.a039248.","Richardson TG","Cold Spring Harb Perspect Med","2021","2020/12/08","PMC8168525","","10.1101/cshperspect.a039248"
"35386996","Purinergic Receptors in the Airways: Potential Therapeutic Targets for Asthma?","Thompson RJ, Sayers I, Kuokkanen K, Hall IP.","Front Allergy. 2021 May 31;2:677677. doi: 10.3389/falgy.2021.677677. eCollection 2021.","Thompson RJ","Front Allergy","2021","2022/04/07","PMC8974712","","10.3389/falgy.2021.677677"
"34135900","Host-Parasite Interaction of Atlantic salmon (Salmo salar) and the Ectoparasite Neoparamoeba perurans in Amoebic Gill Disease","Botwright NA, Mohamed AR, Slinger J, Lima PC, Wynne JW.","Front Immunol. 2021 May 31;12:672700. doi: 10.3389/fimmu.2021.672700. eCollection 2021.","Botwright NA","Front Immunol","2021","2021/06/17","PMC8202022","","10.3389/fimmu.2021.672700"
"33313682","Understanding the Molecular Drivers of Disease Heterogeneity in Crohn's Disease Using Multi-omic Data Integration and Network Analysis","Sudhakar P, Verstockt B, Cremer J, Verstockt S, Sabino J, Ferrante M, Vermeire S.","Inflamm Bowel Dis. 2021 May 17;27(6):870-886. doi: 10.1093/ibd/izaa281.","Sudhakar P","Inflamm Bowel Dis","2021","2020/12/14","PMC8128416","","10.1093/ibd/izaa281"
"34055023","Systems Pharmacology and In Silico Docking Analysis Uncover Association of CA2, PPARG, RXRA, and VDR with the Mechanisms Underlying the Shi Zhen Tea Formula Effect on Eczema","Wang ZZ, Jia Y, Srivastava KD, Huang W, Tiwari R, Nowak-Wegrzyn A, Geliebter J, Miao M, Li XM.","Evid Based Complement Alternat Med. 2021 May 13;2021:8406127. doi: 10.1155/2021/8406127. eCollection 2021.","Wang ZZ","Evid Based Complement Alternat Med","2021","2021/05/31","PMC8143894","","10.1155/2021/8406127"
"33303529","Genome-wide association study of asthma exacerbations despite inhaled corticosteroid use","Hernandez-Pacheco N, Vijverberg SJ, Herrera-Luis E, Li J, Sio YY, Granell R, Corrales A, Maroteau C, Lethem R, Perez-Garcia J, Farzan N, Repnik K, Gorenjak M, Soares P, Karimi L, Schieck M, Pérez-Méndez L, Berce V, Tavendale R, Eng C, Sardon O, Kull I, Mukhopadhyay S, Pirmohamed M, Verhamme KMC, Burchard EG, Kabesch M, Hawcutt DB, Melén E, Potočnik U, Chew FT, Tantisira KG, Turner S, Palmer CN, Flores C, Pino-Yanes M, Maitland-van der Zee AH; PiCA and SysPharmPedia consortia.","Eur Respir J. 2021 May 13;57(5):2003388. doi: 10.1183/13993003.03388-2020. Print 2021 May.","Hernandez-Pacheco N","Eur Respir J","2021","2020/12/11","PMC8122045","NIHMS1671237","10.1183/13993003.03388-2020"
"33979322","Genetic variation affects morphological retinal phenotypes extracted from UK Biobank optical coherence tomography images","Currant H, Hysi P, Fitzgerald TW, Gharahkhani P, Bonnemaijer PWM, Senabouth A, Hewitt AW; UK Biobank Eye and Vision Consortium; International Glaucoma Genetics Consortium; Atan D, Aung T, Charng J, Choquet H, Craig J, Khaw PT, Klaver CCW, Kubo M, Ong JS, Pasquale LR, Reisman CA, Daniszewski M, Powell JE, Pébay A, Simcoe MJ, Thiadens AAHJ, van Duijn CM, Yazar S, Jorgenson E, MacGregor S, Hammond CJ, Mackey DA, Wiggs JL, Foster PJ, Patel PJ, Birney E, Khawaja AP.","PLoS Genet. 2021 May 12;17(5):e1009497. doi: 10.1371/journal.pgen.1009497. eCollection 2021 May.","Currant H","PLoS Genet","2021","2021/05/12","PMC8143408","","10.1371/journal.pgen.1009497"
"34040530","Unraveling the Catha edulis Extract Effects on the Cellular and Molecular Signaling in SKOV3 Cells","Abou-Elhamd AS, Kalamegam G, Ahmed F, Assidi M, Alrefaei AF, Pushparaj PN, Abu-Elmagd M.","Front Pharmacol. 2021 May 10;12:666885. doi: 10.3389/fphar.2021.666885. eCollection 2021.","Abou-Elhamd AS","Front Pharmacol","2021","2021/05/27","PMC8141790","","10.3389/fphar.2021.666885"
"33952262","Predictive value of RAD51 on the survival and drug responsiveness of ovarian cancer","Feng Y, Wang D, Xiong L, Zhen G, Tan J.","Cancer Cell Int. 2021 May 5;21(1):249. doi: 10.1186/s12935-021-01953-5.","Feng Y","Cancer Cell Int","2021","2021/05/06","PMC8097773","","10.1186/s12935-021-01953-5"
"34693284","Evidence for GRN connecting multiple neurodegenerative diseases","Nalls MA, Blauwendraat C, Sargent L, Vitale D, Leonard H, Iwaki H, Song Y, Bandres-Ciga S, Menden K, Faghri F, Heutink P, Cookson MR, Singleton AB.","Brain Commun. 2021 May 1;3(2):fcab095. doi: 10.1093/braincomms/fcab095. eCollection 2021.","Nalls MA","Brain Commun","2021","2021/10/25","PMC8134835","","10.1093/braincomms/fcab095"
"33875891","An expanded set of genome-wide association studies of brain imaging phenotypes in UK Biobank","Smith SM, Douaud G, Chen W, Hanayik T, Alfaro-Almagro F, Sharp K, Elliott LT.","Nat Neurosci. 2021 May;24(5):737-745. doi: 10.1038/s41593-021-00826-4. Epub 2021 Apr 19.","Smith SM","Nat Neurosci","2021","2021/04/20","PMC7610742","EMS123172","10.1038/s41593-021-00826-4"
"33828297","Genome-wide enhancer maps link risk variants to disease genes","Nasser J, Bergman DT, Fulco CP, Guckelberger P, Doughty BR, Patwardhan TA, Jones TR, Nguyen TH, Ulirsch JC, Lekschas F, Mualim K, Natri HM, Weeks EM, Munson G, Kane M, Kang HY, Cui A, Ray JP, Eisenhaure TM, Collins RL, Dey K, Pfister H, Price AL, Epstein CB, Kundaje A, Xavier RJ, Daly MJ, Huang H, Finucane HK, Hacohen N, Lander ES, Engreitz JM.","Nature. 2021 May;593(7858):238-243. doi: 10.1038/s41586-021-03446-x. Epub 2021 Apr 7.","Nasser J","Nature","2021","2021/04/08","PMC9153265","NIHMS1785562","10.1038/s41586-021-03446-x"
"33737208","Search and visualization of gene-drug-disease interactions for pharmacogenomics and precision medicine research using GeneDive","Wong M, Previde P, Cole J, Thomas B, Laxmeshwar N, Mallory E, Lever J, Petkovic D, Altman RB, Kulkarni A.","J Biomed Inform. 2021 May;117:103732. doi: 10.1016/j.jbi.2021.103732. Epub 2021 Mar 16.","Wong M","J Biomed Inform","2021","2021/03/19","PMC9042200","NIHMS1792106","10.1016/j.jbi.2021.103732"
"33483996","De-coding genetic risk variants in type 1 diabetes","Shapiro MR, Thirawatananond P, Peters L, Sharp RC, Ogundare S, Posgai AL, Perry DJ, Brusko TM.","Immunol Cell Biol. 2021 May;99(5):496-508. doi: 10.1111/imcb.12438. Epub 2021 Feb 24.","Shapiro MR","Immunol Cell Biol","2021","2021/01/23","PMC8119379","NIHMS1693426","10.1111/imcb.12438"
"33925648","In Silico Exploration of the Potential Role of Acetaminophen and Pesticides in the Etiology of Autism Spectrum Disorder","Furnary T, Garcia-Milian R, Liew Z, Whirledge S, Vasiliou V.","Toxics. 2021 Apr 27;9(5):97. doi: 10.3390/toxics9050097.","Furnary T","Toxics","2021","2021/04/30","PMC8146009","","10.3390/toxics9050097"
"33922167","Antiulcer Potential of Olea europea L. cv. Arbequina Leaf Extract Supported by Metabolic Profiling and Molecular Docking","Musa A, Shady NH, Ahmed SR, Alnusaire TS, Sayed AM, Alowaiesh BF, Sabouni I, Al-Sanea MM, Mostafa EM, Youssif KA, Abu-Baih DH, Elrehany MA, Abdelmohsen UR.","Antioxidants (Basel). 2021 Apr 22;10(5):644. doi: 10.3390/antiox10050644.","Musa A","Antioxidants (Basel)","2021","2021/04/30","PMC8146603","","10.3390/antiox10050644"
"33912047","A New Insight for the Identification of Oncogenic Variants in Breast and Prostate Cancers in Diverse Human Populations, With a Focus on Latinos","Varela NM, Guevara-Ramírez P, Acevedo C, Zambrano T, Armendáriz-Castillo I, Guerrero S, Quiñones LA, López-Cortés A.","Front Pharmacol. 2021 Apr 12;12:630658. doi: 10.3389/fphar.2021.630658. eCollection 2021.","Varela NM","Front Pharmacol","2021","2021/04/29","PMC8072346","","10.3389/fphar.2021.630658"
"33836063","MendelVar: gene prioritization at GWAS loci using phenotypic enrichment of Mendelian disease genes","Sobczyk MK, Gaunt TR, Paternoster L.","Bioinformatics. 2021 Apr 9;37(1):1-8. doi: 10.1093/bioinformatics/btaa1096.","Sobczyk MK","Bioinformatics","2021","2021/04/09","PMC8034535","","10.1093/bioinformatics/btaa1096"
"33416828","A method for subtype analysis with somatic mutations","Liu M, Liu Y, Wu MC, Hsu L, He Q.","Bioinformatics. 2021 Apr 9;37(1):50-56. doi: 10.1093/bioinformatics/btaa1090.","Liu M","Bioinformatics","2021","2021/01/08","PMC11394914","","10.1093/bioinformatics/btaa1090"
"33779029","Absence of RNA-binding protein FXR2P prevents prolonged phase of kainate-induced seizures","Lo AC, Rajan N, Gastaldo D, Telley L, Hilal ML, Buzzi A, Simonato M, Achsel T, Bagni C.","EMBO Rep. 2021 Apr 7;22(4):e51404. doi: 10.15252/embr.202051404. Epub 2021 Mar 28.","Lo AC","EMBO Rep","2021","2021/03/29","PMC8024897","","10.15252/embr.202051404"
"33823809","The transcriptional landscape of a hepatoma cell line grown on scaffolds of extracellular matrix proteins","Ghosh S, Börsch A, Ghosh S, Zavolan M.","BMC Genomics. 2021 Apr 6;22(1):238. doi: 10.1186/s12864-021-07532-2.","Ghosh S","BMC Genomics","2021","2021/04/07","PMC8025518","","10.1186/s12864-021-07532-2"
"33798443","A catalog of GWAS fine-mapping efforts in autoimmune disease","Caliskan M, Brown CD, Maranville JC.","Am J Hum Genet. 2021 Apr 1;108(4):549-563. doi: 10.1016/j.ajhg.2021.03.009.","Caliskan M","Am J Hum Genet","2021","2021/04/02","PMC8059376","","10.1016/j.ajhg.2021.03.009"
"33749932","A small molecule compound berberine as an orally active therapeutic candidate against COVID-19 and SARS: A computational and mechanistic study","Wang ZZ, Li K, Maskey AR, Huang W, Toutov AA, Yang N, Srivastava K, Geliebter J, Tiwari R, Miao M, Li XM.","FASEB J. 2021 Apr;35(4):e21360. doi: 10.1096/fj.202001792R.","Wang ZZ","FASEB J","2021","2021/03/22","PMC8250068","","10.1096/fj.202001792R"
"33625251","System Genetics Including Causal Inference Identify Immune Targets for Coronary Artery Disease and the Lifespan","Bon-Baret V, Chignon A, Boulanger MC, Li Z, Argaud D, Arsenault BJ, Thériault S, Bossé Y, Mathieu P.","Circ Genom Precis Med. 2021 Apr;14(2):e003196. doi: 10.1161/CIRCGEN.120.003196. Epub 2021 Feb 24.","Bon-Baret V","Circ Genom Precis Med","2021","2021/02/24","PMC8284374","","10.1161/CIRCGEN.120.003196"
"33508423","Artificial intelligence in drug discovery: what is realistic, what are illusions? Part 2: a discussion of chemical and biological data","Bender A, Cortes-Ciriano I.","Drug Discov Today. 2021 Apr;26(4):1040-1052. doi: 10.1016/j.drudis.2020.11.037. Epub 2021 Jan 27.","Bender A","Drug Discov Today","2021","2021/01/28","PMC8132984","","10.1016/j.drudis.2020.11.037"
"33806076","Emerging Role of ODC1 in Neurodevelopmental Disorders and Brain Development","Prokop JW, Bupp CP, Frisch A, Bilinovich SM, Campbell DB, Vogt D, Schultz CR, Uhl KL, VanSickle E, Rajasekaran S, Bachmann AS.","Genes (Basel). 2021 Mar 25;12(4):470. doi: 10.3390/genes12040470.","Prokop JW","Genes (Basel)","2021","2021/04/03","PMC8064465","","10.3390/genes12040470"
"33758314","Herb-target virtual screening and network pharmacology for prediction of molecular mechanism of Danggui Beimu Kushen Wan for prostate cancer","Li H, Hung A, Yang AWH.","Sci Rep. 2021 Mar 23;11(1):6656. doi: 10.1038/s41598-021-86141-1.","Li H","Sci Rep","2021","2021/03/24","PMC7988104","","10.1038/s41598-021-86141-1"
"33569598","Integrated network analysis reveals new genes suggesting COVID-19 chronic effects and treatment","Pavel A, Del Giudice G, Federico A, Di Lieto A, Kinaret PAS, Serra A, Greco D.","Brief Bioinform. 2021 Mar 22;22(2):1430-1441. doi: 10.1093/bib/bbaa417.","Pavel A","Brief Bioinform","2021","2021/02/11","PMC7929418","","10.1093/bib/bbaa417"
"32055842","Exploration of databases and methods supporting drug repurposing: a comprehensive survey","Tanoli Z, Seemab U, Scherer A, Wennerberg K, Tang J, Vähä-Koskela M.","Brief Bioinform. 2021 Mar 22;22(2):1656-1678. doi: 10.1093/bib/bbaa003.","Tanoli Z","Brief Bioinform","2021","2020/02/15","PMC7986597","","10.1093/bib/bbaa003"
"33854783","The evolutionary biology of endometriosis","Dinsdale N, Nepomnaschy P, Crespi B.","Evol Med Public Health. 2021 Mar 12;9(1):174-191. doi: 10.1093/emph/eoab008. eCollection 2021.","Dinsdale N","Evol Med Public Health","2021","2021/04/15","PMC8030264","","10.1093/emph/eoab008"
"33235359","RNA-binding proteins in human genetic disease","Gebauer F, Schwarzl T, Valcárcel J, Hentze MW.","Nat Rev Genet. 2021 Mar;22(3):185-198. doi: 10.1038/s41576-020-00302-y. Epub 2020 Nov 24.","Gebauer F","Nat Rev Genet","2021","2020/11/25","","","10.1038/s41576-020-00302-y"
"33035569","A deoxyribonuclease 1-like 3 genetic variant associates with asthma exacerbations","Herrera-Luis E, Lorenzo-Diaz F, Samedy-Bates LA, Eng C, Villar J, Rodriguez-Santana JR, Burchard EG, Pino-Yanes M.","J Allergy Clin Immunol. 2021 Mar;147(3):1095-1097.e10. doi: 10.1016/j.jaci.2020.09.027. Epub 2020 Oct 6.","Herrera-Luis E","J Allergy Clin Immunol","2021","2020/10/09","PMC7940549","NIHMS1642528","10.1016/j.jaci.2020.09.027"
"33632293","Clinical-grade whole-genome sequencing and 3' transcriptome analysis of colorectal cancer patients","Stodolna A, He M, Vasipalli M, Kingsbury Z, Becq J, Stockton JD, Dilworth MP, James J, Sillo T, Blakeway D, Ward ST, Ismail T, Ross MT, Beggs AD.","Genome Med. 2021 Feb 25;13(1):33. doi: 10.1186/s13073-021-00852-8.","Stodolna A","Genome Med","2021","2021/02/26","PMC7908713","","10.1186/s13073-021-00852-8"
"33627673","Genome-wide meta-analysis identifies 127 open-angle glaucoma loci with consistent effect across ancestries","Gharahkhani P, Jorgenson E, Hysi P, Khawaja AP, Pendergrass S, Han X, Ong JS, Hewitt AW, Segrè AV, Rouhana JM, Hamel AR, Igo RP Jr, Choquet H, Qassim A, Josyula NS, Cooke Bailey JN, Bonnemaijer PWM, Iglesias A, Siggs OM, Young TL, Vitart V, Thiadens AAHJ, Karjalainen J, Uebe S, Melles RB, Nair KS, Luben R, Simcoe M, Amersinghe N, Cree AJ, Hohn R, Poplawski A, Chen LJ, Rong SS, Aung T, Vithana EN; NEIGHBORHOOD consortium; ANZRAG consortium; Biobank Japan project; FinnGen study; UK Biobank Eye and Vision Consortium; GIGA study group; 23 and Me Research Team; Tamiya G, Shiga Y, Yamamoto M, Nakazawa T, Currant H, Birney E, Wang X, Auton A, Lupton MK, Martin NG, Ashaye A, Olawoye O, Williams SE, Akafo S, Ramsay M, Hashimoto K, Kamatani Y, Akiyama M, Momozawa Y, Foster PJ, Khaw PT, Morgan JE, Strouthidis NG, Kraft P, Kang JH, Pang CP, Pasutto F, Mitchell P, Lotery AJ, Palotie A, van Duijn C, Haines JL, Hammond C, Pasquale LR, Klaver CCW, Hauser M, Khor CC, Mackey DA, Kubo M, Cheng CY, Craig JE, MacGregor S, Wiggs JL.","Nat Commun. 2021 Feb 24;12(1):1258. doi: 10.1038/s41467-020-20851-4.","Gharahkhani P","Nat Commun","2021","2021/02/25","PMC7904932","","10.1038/s41467-020-20851-4"
"33673213","Receptor Tyrosine Kinase Signaling and Targeting in Glioblastoma Multiforme","Tilak M, Holborn J, New LA, Lalonde J, Jones N.","Int J Mol Sci. 2021 Feb 12;22(4):1831. doi: 10.3390/ijms22041831.","Tilak M","Int J Mol Sci","2021","2021/03/06","PMC7918566","","10.3390/ijms22041831"
"33543862","Multiomics-Identified Intervention to Restore Ethanol-Induced Dysregulated Proteostasis and Secondary Sarcopenia in Alcoholic Liver Disease","Singh SS, Kumar A, Welch N, Sekar J, Mishra S, Bellar A, Gangadhariah M, Attaway A, Al Khafaji H, Wu X, Pathak V, Agrawal V, McMullen MR, Hornberger TA, Nagy LE, Davuluri G, Dasarathy S.","Cell Physiol Biochem. 2021 Feb 6;55(1):91-116. doi: 10.33594/000000327.","Singh SS","Cell Physiol Biochem","2021","2021/02/05","PMC8195260","NIHMS1671322","10.33594/000000327"
"33553934","Using Bibliometric Analysis and Machine Learning to Identify Compounds Binding to Sialidase-1","Klein JJ, Baker NC, Foil DH, Zorn KM, Urbina F, Puhl AC, Ekins S.","ACS Omega. 2021 Jan 20;6(4):3186-3193. doi: 10.1021/acsomega.0c05591. eCollection 2021 Feb 2.","Klein JJ","ACS Omega","2021","2021/02/08","PMC7860073","","10.1021/acsomega.0c05591"
"33495597","Common genetic variants and modifiable risk factors underpin hypertrophic cardiomyopathy susceptibility and expressivity","Harper AR, Goel A, Grace C, Thomson KL, Petersen SE, Xu X, Waring A, Ormondroyd E, Kramer CM, Ho CY, Neubauer S; HCMR Investigators; Tadros R, Ware JS, Bezzina CR, Farrall M, Watkins H.","Nat Genet. 2021 Feb;53(2):135-142. doi: 10.1038/s41588-020-00764-0. Epub 2021 Jan 25.","Harper AR","Nat Genet","2021","2021/01/26","PMC8240954","NIHMS1706161","10.1038/s41588-020-00764-0"
"33462484","Genetics of 35 blood and urine biomarkers in the UK Biobank","Sinnott-Armstrong N, Tanigawa Y, Amar D, Mars N, Benner C, Aguirre M, Venkataraman GR, Wainberg M, Ollila HM, Kiiskinen T, Havulinna AS, Pirruccello JP, Qian J, Shcherbina A; FinnGen; Rodriguez F, Assimes TL, Agarwala V, Tibshirani R, Hastie T, Ripatti S, Pritchard JK, Daly MJ, Rivas MA.","Nat Genet. 2021 Feb;53(2):185-194. doi: 10.1038/s41588-020-00757-z. Epub 2021 Jan 18.","Sinnott-Armstrong N","Nat Genet","2021","2021/01/19","PMC7867639","NIHMS1651539","10.1038/s41588-020-00757-z"
"33345267","CXCL10 is a potential biomarker and associated with immune infiltration in human papillary thyroid cancer","Qin XJ, Lin X, Xue G, Fan HL, Wang HY, Wu JF, Pei D.","Biosci Rep. 2021 Jan 29;41(1):BSR20203459. doi: 10.1042/BSR20203459.","Qin XJ","Biosci Rep","2021","2020/12/21","PMC7791606","","10.1042/BSR20203459"
"33417599","Identifying drug targets for neurological and psychiatric disease via genetics and the brain transcriptome","Baird DA, Liu JZ, Zheng J, Sieberts SK, Perumal T, Elsworth B, Richardson TG, Chen CY, Carrasquillo MM, Allen M, Reddy JS, De Jager PL, Ertekin-Taner N, Mangravite LM, Logsdon B, Estrada K, Haycock PC, Hemani G, Runz H, Smith GD, Gaunt TR; AMP-AD eQTL working group.","PLoS Genet. 2021 Jan 8;17(1):e1009224. doi: 10.1371/journal.pgen.1009224. eCollection 2021 Jan.","Baird DA","PLoS Genet","2021","2021/01/08","PMC7819609","","10.1371/journal.pgen.1009224"
"33396976","The 2021 Nucleic Acids Research database issue and the online molecular biology database collection","Rigden DJ, Fernández XM.","Nucleic Acids Res. 2021 Jan 8;49(D1):D1-D9. doi: 10.1093/nar/gkaa1216.","Rigden DJ","Nucleic Acids Res","2021","2021/01/05","PMC7778882","","10.1093/nar/gkaa1216"
"33245775","The European Bioinformatics Institute: empowering cooperation in response to a global health crisis","Cantelli G, Cochrane G, Brooksbank C, McDonagh E, Flicek P, McEntyre J, Birney E, Apweiler R.","Nucleic Acids Res. 2021 Jan 8;49(D1):D29-D37. doi: 10.1093/nar/gkaa1077.","Cantelli G","Nucleic Acids Res","2021","2020/11/27","PMC7778996","","10.1093/nar/gkaa1077"
"33237286","UniProt: the universal protein knowledgebase in 2021","UniProt Consortium.","Nucleic Acids Res. 2021 Jan 8;49(D1):D480-D489. doi: 10.1093/nar/gkaa1100.","UniProt Consortium","Nucleic Acids Res","2021","2020/11/25","PMC7778908","","10.1093/nar/gkaa1100"
"33196847","Open Targets Platform: supporting systematic drug-target identification and prioritisation","Ochoa D, Hercules A, Carmona M, Suveges D, Gonzalez-Uriarte A, Malangone C, Miranda A, Fumis L, Carvalho-Silva D, Spitzer M, Baker J, Ferrer J, Raies A, Razuvayevskaya O, Faulconbridge A, Petsalaki E, Mutowo P, Machlitt-Northen S, Peat G, McAuley E, Ong CK, Mountjoy E, Ghoussaini M, Pierleoni A, Papa E, Pignatelli M, Koscielny G, Karim M, Schwartzentruber J, Hulcoop DG, Dunham I, McDonagh EM.","Nucleic Acids Res. 2021 Jan 8;49(D1):D1302-D1310. doi: 10.1093/nar/gkaa1027.","Ochoa D","Nucleic Acids Res","2021","2020/11/16","PMC7779013","","10.1093/nar/gkaa1027"
"33180112","Europe PMC in 2020","Ferguson C, Araújo D, Faulk L, Gou Y, Hamelers A, Huang Z, Ide-Smith M, Levchenko M, Marinos N, Nambiar R, Nassar M, Parkin M, Pi X, Rahman F, Rogers F, Roochun Y, Saha S, Selim M, Shafique Z, Sharma S, Stephenson D, Talo' F, Thouvenin A, Tirunagari S, Vartak V, Venkatesan A, Yang X, McEntyre J.","Nucleic Acids Res. 2021 Jan 8;49(D1):D1507-D1514. doi: 10.1093/nar/gkaa994.","Ferguson C","Nucleic Acids Res","2021","2020/11/12","PMC7778976","","10.1093/nar/gkaa994"
"33068406","Project Score database: a resource for investigating cancer cell dependencies and prioritizing therapeutic targets","Dwane L, Behan FM, Gonçalves E, Lightfoot H, Yang W, van der Meer D, Shepherd R, Pignatelli M, Iorio F, Garnett MJ.","Nucleic Acids Res. 2021 Jan 8;49(D1):D1365-D1372. doi: 10.1093/nar/gkaa882.","Dwane L","Nucleic Acids Res","2021","2020/10/17","PMC7778984","","10.1093/nar/gkaa882"
"33045747","Open Targets Genetics: systematic identification of trait-associated genes using large-scale genetics and functional genomics","Ghoussaini M, Mountjoy E, Carmona M, Peat G, Schmidt EM, Hercules A, Fumis L, Miranda A, Carvalho-Silva D, Buniello A, Burdett T, Hayhurst J, Baker J, Ferrer J, Gonzalez-Uriarte A, Jupp S, Karim MA, Koscielny G, Machlitt-Northen S, Malangone C, Pendlington ZM, Roncaglia P, Suveges D, Wright D, Vrousgou O, Papa E, Parkinson H, MacArthur JAL, Todd JA, Barrett JC, Schwartzentruber J, Hulcoop DG, Ochoa D, McDonagh EM, Dunham I.","Nucleic Acids Res. 2021 Jan 8;49(D1):D1311-D1320. doi: 10.1093/nar/gkaa840.","Ghoussaini M","Nucleic Acids Res","2021","2020/10/12","PMC7778936","","10.1093/nar/gkaa840"
"32986829","CMNPD: a comprehensive marine natural products database towards facilitating drug discovery from the ocean","Lyu C, Chen T, Qiang B, Liu N, Wang H, Zhang L, Liu Z.","Nucleic Acids Res. 2021 Jan 8;49(D1):D509-D515. doi: 10.1093/nar/gkaa763.","Lyu C","Nucleic Acids Res","2021","2020/09/28","PMC7779072","","10.1093/nar/gkaa763"
"33326753","Leveraging phenotypic variability to identify genetic interactions in human phenotypes","Marderstein AR, Davenport ER, Kulm S, Van Hout CV, Elemento O, Clark AG.","Am J Hum Genet. 2021 Jan 7;108(1):49-67. doi: 10.1016/j.ajhg.2020.11.016. Epub 2020 Dec 15.","Marderstein AR","Am J Hum Genet","2021","2020/12/16","PMC7820920","","10.1016/j.ajhg.2020.11.016"
"33410475","Germline variants are associated with increased primary melanoma tumor thickness at diagnosis","Mangantig E, MacGregor S, Iles MM, Scolyer RA, Cust AE, Hayward NK, Montgomery GW, Duffy DL, Thompson JF, Henders A, Bowdler L, Rowe C, Cadby G, Mann GJ, Whiteman DC, Long GV, Ward SV, Khosrotehrani K, Barrett JH, Law MH.","Hum Mol Genet. 2021 Jan 6;29(21):3578-3587. doi: 10.1093/hmg/ddaa222.","Mangantig E","Hum Mol Genet","2021","2021/01/07","PMC7788289","","10.1093/hmg/ddaa222"
"33416099","Transcriptomic landscaping of core genes and pathways of mild and severe psoriasis vulgaris","Choudhary S, Anand R, Pradhan D, Bastia B, Kumar SN, Singh H, Puri P, Thomas G, Jain AK.","Int J Mol Med. 2021 Jan;47(1):219-231. doi: 10.3892/ijmm.2020.4771. Epub 2020 Oct 27.","Choudhary S","Int J Mol Med","2021","2021/01/08","PMC7723513","","10.3892/ijmm.2020.4771"
"33235614","Anti-inflammatory activity of Radix Angelicae biseratae in the treatment of osteoarthritis determined by systematic pharmacology and in vitro experiments","Chen Z, Zheng R, Chen J, Fu C, Lin J, Wu G.","Exp Ther Med. 2021 Jan;21(1):5. doi: 10.3892/etm.2020.9437. Epub 2020 Nov 2.","Chen Z","Exp Ther Med","2021","2020/11/25","PMC7678626","","10.3892/etm.2020.9437"
"33199880","Improving target assessment in biomedical research: the GOT-IT recommendations","Emmerich CH, Gamboa LM, Hofmann MCJ, Bonin-Andresen M, Arbach O, Schendel P, Gerlach B, Hempel K, Bespalov A, Dirnagl U, Parnham MJ.","Nat Rev Drug Discov. 2021 Jan;20(1):64-81. doi: 10.1038/s41573-020-0087-3. Epub 2020 Nov 16.","Emmerich CH","Nat Rev Drug Discov","2021","2020/11/17","PMC7667479","","10.1038/s41573-020-0087-3"
"33168624","PRAP1 is a novel lipid-binding protein that promotes lipid absorption by facilitating MTTP-mediated lipid transport","Peng H, Chiu TY, Liang YJ, Lee CJ, Liu CS, Suen CS, Yen JJ, Chen HT, Hwang MJ, Hussain MM, Yang HC, Yang-Yen HF.","J Biol Chem. 2021 Jan-Jun;296:100052. doi: 10.1074/jbc.RA120.015002. Epub 2020 Nov 24.","Peng H","J Biol Chem","2021","2020/11/10","PMC7949078","","10.1074/jbc.RA120.015002"
"32841424","Genome-wide association study reveals a novel locus for asthma with severe exacerbations in diverse populations","Herrera-Luis E, Espuela-Ortiz A, Lorenzo-Diaz F, Keys KL, Mak ACY, Eng C, Huntsman S, Villar J, Rodriguez-Santana JR, Burchard EG, Pino-Yanes M.","Pediatr Allergy Immunol. 2021 Jan;32(1):106-115. doi: 10.1111/pai.13337. Epub 2020 Sep 14.","Herrera-Luis E","Pediatr Allergy Immunol","2021","2020/08/26","PMC7886969","NIHMS1631691","10.1111/pai.13337"
"33374283","Mexican Ganoderma Lucidum Extracts Decrease Lipogenesis Modulating Transcriptional Metabolic Networks and Gut Microbiota in C57BL/6 Mice Fed with a High-Cholesterol Diet","Romero-Córdoba SL, Salido-Guadarrama I, Meneses ME, Cosentino G, Iorio MV, Tagliabue E, Torres N, Sánchez-Tapia M, Bonilla M, Castillo I, Petlacalco B, Tovar AR, Martínez-Carrera D.","Nutrients. 2020 Dec 24;13(1):38. doi: 10.3390/nu13010038.","Romero-Córdoba SL","Nutrients","2020","2020/12/30","PMC7823885","","10.3390/nu13010038"
